{
  "dunstan": "0.1",
  "headCommit": "8a2f22f0209c3a88b513e82d4e9040d754d9646d",
  "filesChanged": [
    ".azure/azure-pipelines-alpine.yml",
    ".azure/azure-pipelines-android.yml",
    ".azure/azure-pipelines-mac.yml",
    ".azure/cmake-android.yml",
    ".github/workflows/api_doc_build.yml",
    ".github/workflows/freebsd.yml",
    ".github/workflows/ios.yml",
    ".github/workflows/linux.yml",
    ".github/workflows/os2.yml",
    ".github/workflows/rendering-regression.yml",
    ".github/workflows/solaris.yml",
    ".github/workflows/sonarcloud.yml",
    ".github/workflows/windows.yml",
    "CMakeLists.txt",
    "cmake_admin/FluidUnitTest.cmake",
    "test-android/.gitignore",
    "test-android/README.md",
    "test-android/app/.gitignore",
    "test-android/app/build.gradle",
    "test-android/app/proguard-rules.pro",
    "test-android/app/src/androidTest/java/org/fluidsynth/fluidsynth_tests/ExampleInstrumentedTest.kt",
    "test-android/app/src/main/AndroidManifest.xml",
    "test-android/app/src/main/cpp/CMakeLists.txt",
    "test-android/app/src/main/cpp/native-lib.cpp",
    "test-android/app/src/main/java/org/fluidsynth/fluidsynthtests/MainActivity.kt",
    "test-android/app/src/main/java/org/fluidsynth/fluidsynthtests/TestRunner.kt",
    "test-android/app/src/main/res/drawable-v24/ic_launcher_foreground.xml",
    "test-android/app/src/main/res/drawable/ic_launcher_background.xml",
    "test-android/app/src/main/res/layout/activity_main.xml",
    "test-android/app/src/main/res/mipmap-anydpi-v26/ic_launcher.xml",
    "test-android/app/src/main/res/mipmap-anydpi-v26/ic_launcher_round.xml",
    "test-android/app/src/main/res/mipmap-hdpi/ic_launcher.png",
    "test-android/app/src/main/res/mipmap-hdpi/ic_launcher_round.png",
    "test-android/app/src/main/res/mipmap-mdpi/ic_launcher.png",
    "test-android/app/src/main/res/mipmap-mdpi/ic_launcher_round.png",
    "test-android/app/src/main/res/mipmap-xhdpi/ic_launcher.png",
    "test-android/app/src/main/res/mipmap-xhdpi/ic_launcher_round.png",
    "test-android/app/src/main/res/mipmap-xxhdpi/ic_launcher.png",
    "test-android/app/src/main/res/mipmap-xxhdpi/ic_launcher_round.png",
    "test-android/app/src/main/res/mipmap-xxxhdpi/ic_launcher.png",
    "test-android/app/src/main/res/mipmap-xxxhdpi/ic_launcher_round.png",
    "test-android/app/src/main/res/values-night/themes.xml",
    "test-android/app/src/main/res/values/colors.xml",
    "test-android/app/src/main/res/values/strings.xml",
    "test-android/app/src/main/res/values/themes.xml",
    "test-android/app/src/test/java/org/fluidsynth/fluidsynth_tests/ExampleUnitTest.kt",
    "test-android/build-scripts/.gitignore",
    "test-android/build-scripts/build-all-archs.sh",
    "test-android/build-scripts/build-call-cmake.sh",
    "test-android/build-scripts/build-env.sh",
    "test-android/build-scripts/build.sh",
    "test-android/build-scripts/download.sh",
    "test-android/build-scripts/extract.sh",
    "test-android/build.gradle",
    "test-android/convert-tests.sh",
    "test-android/gradle.properties",
    "test-android/gradle/wrapper/gradle-wrapper.jar",
    "test-android/gradle/wrapper/gradle-wrapper.properties",
    "test-android/gradlew",
    "test-android/gradlew.bat",
    "test-android/settings.gradle",
    "test/CMakeLists.txt",
    "test/run-android-tests.sh"
  ],
  "references": [
    {
      "issue": "#912",
      "relation": "closes"
    }
  ],
  "mergedAt": "2026-09-27T13:06:24Z"
}
